{
  "version": "1.2",
  "language": "zh-CN",
  "framework": "RIASEC + auxiliary preferences with bias controls",
  "scenarios": [
    {
      "id": "S001",
      "title": "模糊小组项目",
      "ask": "你现在打开小组群，第一步会做什么？你会发什么、私聊谁，或者先自己做什么？接下来一天你会怎么推进这个项目？",
      "know": "你在一门专业课里加入了四人小组。老师只给了一个宽泛主题，没有明确评分细则，也没有指定组长。群里已经安静两天，截止时间还有两周，最后成果会影响课程成绩。你打开小组群，发现仍然没有人提出方向，也没有人认领任务。约束：没有明确评分标准；没有正式组长；截止时间还有两周但已经空转两天；组员能力和投入程度未知；你不确定主动推进会不会被默认成全责。社会动态：组员可能在观望；有人可能想低投入完成；主动的人可能被分配更多隐性责任；过于强硬可能破坏协作氛围。距离提交还有两周，但如果继续空转，后面会被迫赶工。赌注：最终成绩受影响；你可能承担过多工作；组员关系可能受影响；项目方向越晚确定，试错空间越小。",
      "bias": {
        "risk": "小组项目容易诱导学生给出看起来负责任的答案。；题目包含模糊任务，可能诱导学生展示分析和规划能力。",
        "dont": "不要仅因为学生说会负责就给 E 高分。；不要仅因为学生提到截止时间就给 C 高分。；不要仅因为学生发现组员沉默就给 S 高分。",
        "only": "只有学生自发提出具体沟通动作、分工方式或边界设置时，才记录 E/S/C 或 boundary_management。；只有学生自发说明如何从模糊主题中找信息、拆方向或验证可行性时，才记录 I 或 structured_thinking。；只有学生主动描述如何避免被搭便车时，才记录 boundary_management。"
      },
      "rubric": [
        {
          "when": "主动发起沟通、组织讨论、推动成员给出选择或承诺——只有学生自发写出具体发言、私聊对象、会议安排或推进动作时才计分",
          "add": {
            "E": 2,
            "S": 1,
            "collaboration_preference": 1
          },
          "confidence_condition": "能描述第一句话和后续动作时置信度较高。"
        },
        {
          "when": "先查资料、找样例、把宽泛主题拆成可选方向——只有学生自发说明查什么、如何拆方向、如何验证可行性时才计分",
          "add": {
            "I": 2,
            "structured_thinking": 1,
            "uncertainty_tolerance": 1
          },
          "confidence_condition": "能说出信息来源和筛选标准时置信度较高。"
        },
        {
          "when": "主动确认交付格式、质量标准、截止节点或可控流程——只有学生自发提出规则、标准、节点、清单或可控流程时才计分；不要因为题目有截止时间就计分",
          "add": {
            "C": 1,
            "structured_thinking": 1
          },
          "confidence_condition": "能说明标准如何减少返工或降低风险时置信度较高。"
        },
        {
          "when": "提前设置责任边界，避免被搭便车或被默认承担全部工作——只有学生自发提出边界话术、验收方式或责任划分时才计分",
          "add": {
            "E": 1,
            "boundary_management": 2
          },
          "confidence_condition": "能兼顾关系和边界时置信度较高。"
        }
      ]
    },
    {
      "id": "S002",
      "title": "课程压力下的职业机会",
      "ask": "你现在打开电脑或手机，第一步会做什么？今晚你会怎么处理这个机会？这周剩下几天你会怎么安排它和课程任务？",
      "know": "周三晚上 10 点，你刚写完一半实验报告，明天上午还有课。你刷到一个和未来职业有关的小项目招募，报名截止是本周五。它可能帮你积累作品和经验，但接下来两周每天都要挤时间准备，而且不保证有结果。你在手机上看到项目招募信息，并发现报名截止时间很近。约束：实验报告还没完成；明天上午有课；项目需要两周持续投入；项目结果不确定；你不能完全放弃课程任务。社会动态：可能需要联系项目负责人；可能需要找同伴一起做；身边人可能不理解这个投入；你可能需要公开展示阶段成果。今晚已经 10 点，报名截止是本周五。赌注：投入后可能获得作品、反馈和经验；投入失败会消耗课程时间；不投入可能错过一次职业验证机会。",
      "bias": {
        "risk": "职业机会场景可能诱导学生展示理性分析。；成长机会可能让学生选择看起来更上进的答案。；有截止时间可能诱导学生谈计划，从而高估 C。",
        "dont": "不要仅因为学生比较投入和不投入就给 I/C 高分。；不要仅因为学生说机会有价值就给 growth_drive 高分。；不要把课程压力下的保守选择直接解释为稳定偏好高。",
        "only": "只有学生自发提出具体信息来源、验证动作或停止条件时，才记录 I 或 structured_thinking。；只有学生愿意做低成本作品、公开输出或找反馈时，才记录 growth_drive/autonomy。"
      },
      "rubric": [
        {
          "when": "先查看项目要求、交付物、时间成本、负责人信息或可信度——只有学生自发说明要看哪些具体信息和如何判断可信度时才计分",
          "add": {
            "I": 1,
            "structured_thinking": 1,
            "uncertainty_tolerance": 1
          },
          "confidence_condition": "能说出信息来源、筛选标准和不确定点时置信度较高。"
        },
        {
          "when": "设计低成本验证动作，如咨询、报名试水、小 demo、记录、公开反馈——只有学生自发提出具体行动而不是泛泛说想尝试时才计分",
          "add": {
            "I": 1,
            "A": 1,
            "growth_drive": 1,
            "autonomy": 1
          },
          "confidence_condition": "有时间安排、产出形式和反馈渠道时置信度较高。"
        },
        {
          "when": "明确把课程任务、项目机会和风险边界放在一起安排——只有学生自发说出保留、暂停或止损条件时才记录；不要自动给 C 高分",
          "add": {
            "stability_preference": 1,
            "structured_thinking": 1
          },
          "confidence_condition": "能说清楚边界而不是简单逃避时置信度较高。"
        },
        {
          "when": "主动联系负责人、同伴或潜在反馈对象，推动机会变成可执行行动——只有学生自发提出联系对象、沟通方式或协作安排时才计分",
          "add": {
            "E": 1,
            "S": 1,
            "collaboration_preference": 1
          },
          "confidence_condition": "能描述具体开口方式时置信度较高。"
        }
      ]
    },
    {
      "id": "S003",
      "title": "故障排查与止损",
      "ask": "你看到第一个异常后，第一步会点哪里、查哪里或动哪里？半小时后还没解决时，接下来你会怎么处理？",
      "know": "你负责的课程小工具、实验程序或社团报名表单突然出问题。现场没有熟人能立刻帮你，网上能搜到一些类似问题但不完全一样。这个问题不至于马上放弃，但如果拖太久会影响后面的任务。你看到报错、异常结果或用户反馈，确认它不是简单刷新就能解决的问题。约束：问题原因未知；你不确定自己能不能完全解决；继续排查会消耗时间；求助可能需要等待或花钱；放弃会留下后续影响。社会动态：可能有人在等你给结果；求助会暴露自己不会的部分；继续硬扛可能拖累他人进度。你有半小时可以先处理，半小时后需要决定继续、求助还是止损。赌注：解决后能恢复任务；过度投入会造成沉没成本；过早求助可能失去独立解决机会；错误处理可能造成更大损失。",
      "bias": {
        "risk": "故障题天然会诱导排查和分析，不能因此自动高估 I。；技术专业学生可能给出标准答案，但未必代表真实耐心或偏好。",
        "dont": "不要仅因为学生说会排查就给 I 高分。；不要仅因为学生提到半小时就给 C 高分。；不要把求助解释为能力低或 S 高，必须看求助方式和理由。",
        "only": "只有学生自发提出具体检查顺序、控制变量、复现方式或边界条件时，才记录 I/structured_thinking。；只有学生描述动手试验、组件替换、环境复现或实际操作时，才记录 R。；只有学生说明何时求助、问谁、怎么降低损失时，才记录 S 或 collaboration_preference。"
      },
      "rubric": [
        {
          "when": "动手复现、替换组件、检查环境、逐步试验——只有学生自发描述具体操作步骤、复现方式或实际试验时才计分",
          "add": {
            "R": 2,
            "I": 1,
            "autonomy": 1
          },
          "confidence_condition": "能说出先后顺序和排除对象时置信度较高。"
        },
        {
          "when": "自发使用控制变量、边界条件、日志记录或问题复现来缩小范围——只有学生自发说明如何缩小范围而不是泛泛说排查时才计分",
          "add": {
            "I": 2,
            "structured_thinking": 2,
            "uncertainty_tolerance": 1
          },
          "confidence_condition": "能区分可分解和不可分解问题时置信度较高。"
        },
        {
          "when": "偏好记录步骤、错误信息、版本差异、可控流程或检查清单——只有学生自发强调记录、清单、版本、格式、可控流程或细节准确时才计分",
          "add": {
            "C": 1,
            "structured_thinking": 1
          },
          "confidence_condition": "记录是为了复盘和协作时置信度较高。"
        },
        {
          "when": "在卡住时清楚说明求助对象、求助信息和止损边界——只有学生自发说明何时求助、问谁、带什么信息或何时止损时才计分",
          "add": {
            "S": 1,
            "collaboration_preference": 1,
            "uncertainty_tolerance": 1
          },
          "confidence_condition": "能避免盲目硬扛或盲目外包时置信度较高。"
        }
      ]
    },
    {
      "id": "S004",
      "title": "一周时间分配",
      "ask": "你打开待办清单后，第一步会把这一周怎么排？今晚你会先动哪一块？到周三晚上你会看什么信号来调整安排？",
      "know": "这一周你有两类任务。一个是老师给的标准化练习，步骤清楚、提交后基本能拿稳定分数，但重复性较高。另一个是一个开放小任务，需要自己找资料、试方法、做出差异化成果，可能很有成长，但也可能做不出结果。周一晚上你打开待办清单，发现这两类任务都需要本周处理。约束：本周还有其他课程；标准化任务收益稳定；开放任务结果不确定；你当前精力有限；两类任务都不能完全无视。社会动态：老师只看最终提交；同学可能大多选择稳定任务；开放成果如果做得好可能被别人看到。现在是周一晚上，本周五需要至少交出一个可见成果。赌注：稳定任务能保底；开放任务可能积累差异化成果；安排失误会造成两边都做不好。",
      "bias": {
        "risk": "稳定与探索容易变成选择题，学生可能选择看起来更上进的开放任务。；要求安排时间可能诱导计划型回答，从而高估 C。",
        "dont": "不要仅因为学生选择开放任务就给 growth_drive 高分。；不要仅因为学生做时间表就给 C 高分。；不要把保底安排直接解释为稳定偏好高。",
        "only": "只有学生自发说出具体时间分配、保底线、调整信号或停止条件时，才记录 structured_thinking。；只有学生明确表达长期偏好稳定、重复、可控任务时，才记录 C 或 stability_preference。；只有学生愿意为开放结果承担可描述的风险时，才记录 growth_drive/uncertainty_tolerance。"
      },
      "rubric": [
        {
          "when": "自发设置保底线、调整信号、阶段性检查点或止损条件——只有学生自发提出具体检查点、保底线或调整条件时才计分",
          "add": {
            "structured_thinking": 2,
            "uncertainty_tolerance": 1
          },
          "confidence_condition": "能说明周中如何调整时置信度较高。"
        },
        {
          "when": "明确偏好稳定、清晰规则、重复流程、可预测收益或细节执行——只有学生自发把稳定、规则、重复、可控或细节准确当成长期偏好时才计分",
          "add": {
            "C": 1,
            "stability_preference": 2
          },
          "confidence_condition": "如果只是短期保底，不应高置信记录为稳定偏好。"
        },
        {
          "when": "愿意为开放任务保留时间，并说清楚想通过探索获得什么或承担哪些不确定成本——只有学生自发说明愿意承担哪部分不确定成本、想验证什么时才计分",
          "add": {
            "I": 1,
            "growth_drive": 2,
            "autonomy": 1,
            "uncertainty_tolerance": 1
          },
          "confidence_condition": "能说出具体探索方向和止损条件时置信度较高。"
        },
        {
          "when": "把成果展示、机会获取或竞争差异作为安排依据——只有学生自发提到展示、竞争、机会、影响他人或结果转化时才计分",
          "add": {
            "E": 1,
            "growth_drive": 1
          },
          "confidence_condition": "能联系实际机会而不是空泛上进时置信度较高。"
        }
      ]
    },
    {
      "id": "S005",
      "title": "成果被否定后的三天",
      "ask": "你听到这个反馈后的第一步会做什么？你会先找谁确认、先改哪一块，还是先保留原方案？接下来一天你会怎么处理？",
      "know": "你和队友花了几天做出一个展示方案。距离正式展示还有三天，老师或队友突然说方向可能不对，要大改。你们原方案已经能交，但不一定出彩；大改可能更好，也可能因为时间不够变得更差。你刚收到“方向不太对，最好大改”的反馈。约束：只剩三天；原方案可交但不一定好；大改有风险；反馈来源可能可靠也可能只是个人偏好；队友精力和意愿不确定。社会动态：老师和队友的反馈权重不同；队友可能不愿返工；坚持原方案可能被认为固执；全盘接受反馈可能损失原有优势。距离展示还有三天。赌注：大改可能提升成果；大改也可能导致来不及收尾；不改可能错过关键优化；处理方式会影响队友关系和最终表现。",
      "bias": {
        "risk": "反馈题容易诱导学生说自己理性接受建议。；大改与不改容易被学生包装成正确决策，而不是暴露真实反应。；题目可能过度奖励分析反馈来源。",
        "dont": "不要仅因为学生说会听反馈就给 S 或 growth_drive。；不要仅因为学生区分反馈来源就给 I 高分，除非有具体行动。；不要把备份和迭代自动解释为 C，除非学生偏好细节流程和可控执行。",
        "only": "只有学生自发提出确认反馈、保护原方案、试改样稿或分配返工边界时，才记录相关维度。；只有学生明确维护创意表达或用户体验时，才记录 A。；只有学生说明如何和队友协调返工意愿时，才记录 S/E/boundary_management。"
      },
      "rubric": [
        {
          "when": "自发确认反馈来源、目标、样例或关键修改点，再决定行动——只有学生自发提出具体确认对象、确认问题或试验方式时才计分",
          "add": {
            "I": 1,
            "structured_thinking": 1
          },
          "confidence_condition": "能把反馈转成小范围验证时置信度较高。"
        },
        {
          "when": "坚持或保护作品的核心表达、体验、创意记忆点或独特方案——只有学生自发说明哪些表达不能随意牺牲以及为什么时才计分",
          "add": {
            "A": 2,
            "autonomy": 1
          },
          "confidence_condition": "能说明创意目标而不是单纯不想返工时置信度较高。"
        },
        {
          "when": "协调队友返工意愿、分配可承受任务、处理不同意见——只有学生自发描述具体沟通方式、分工方式或边界话术时才计分",
          "add": {
            "S": 1,
            "E": 1,
            "collaboration_preference": 1,
            "boundary_management": 1
          },
          "confidence_condition": "能兼顾成果和关系时置信度较高。"
        },
        {
          "when": "设置备份、版本、截止节点、可控流程或细节标准来降低返工风险——只有学生自发强调备份、版本、节点、标准、流程或可控风险时才计分",
          "add": {
            "C": 1,
            "structured_thinking": 1
          },
          "confidence_condition": "明确这些动作如何保障交付时置信度较高。"
        }
      ]
    },
    {
      "id": "S006",
      "title": "同学求助与个人边界",
      "ask": "你看到这条私信后，第一步会怎么回复？你会问他什么、帮到什么程度，或者怎么保护自己的时间？",
      "know": "考试或项目截止前，一个同学来找你帮忙。他的问题你大概能解决，但你自己的任务也没做完。对方语气很着急，还暗示如果你不帮，他可能这次就过不了。你收到同学的私信，对方希望你现在就帮他处理问题。约束：你自己的任务还没完成；对方问题可能需要较长时间；直接拒绝可能伤关系；直接代做可能损害自己的计划，也可能让对方依赖；你不清楚对方此前是否努力过。社会动态：对方表现得很焦虑；你们关系可能还要继续维持；帮助方式会影响后续边界；同学可能期待你直接解决而不是解释思路。现在距离你自己的截止时间也不远，对方希望马上得到帮助。赌注：帮得太多会压缩自己的时间；帮得太少可能影响关系；代做会造成不健康依赖；合适帮助可能建立正向协作。",
      "bias": {